week,pub_date,title,teaser,url
35,8/31/2011,Green Tomatoes: An End-Of-Summer Bonus,"Most Americans are familiar with fried green tomatoes, where the  under-ripe fruits are dredged in a flour or cornmeal coating and  pan-fried to a delicious crisp. But a  trove of other recipes, from pickles to pasta, make  good use of the garden's detritus.",http://www.npr.org/2011/08/30/140036782/green-tomatoes-an-end-of-summer-bonus
34,8/24/2011,Plain Vanilla No More: Ice Cream To Swoon For,"Black pepper, basil, balsamic vinegar - in ice cream? If typical frozen treats leave you feeling a bit pedestrian, food writer T. Susan Chang has some recommendations that may sweep you off your feet.",http://www.npr.org/2011/08/23/139880816/plain-vanilla-no-more-ice-cream-to-swoon-for
33,8/17/2011,Hold The Mayo ... While I Get A Spoon,"There are people who don't like mayonnaise, and there are people who just ",http://www.npr.org/2011/08/16/139673656/hold-the-mayo-while-i-get-a-spoon
32,8/9/2011,"Corn, East Indian Style","A nearly ubiquitous ingredient in American foods, corn turns up less often in India. But when it does, it's often fresh, hot and abundantly seasoned. Food writer Monica Bhide serves this American summer staple with a twist: spices from her native India.",http://www.npr.org/2011/08/09/139334228/corn-east-indian-style
31,8/3/2011,"Summer Shell Game: Grilled Clams, Mussels, Shrimp","Tucked in their natural confines and simmering in their own briny juices, these delicate meats cook up quick and delicious on the direct heat of the grill. But you may have to eat quickly, too.   You can make them in dozens, yet somehow they vanish off the plate as inexorably as  the last evening tide.",http://www.npr.org/2011/08/03/138917315/summer-shell-game-grilled-clams-mussels-shrimp
30,7/27/2011,The Many Melons Of Summer,"It's hard to beat a plain slice of cool melon on a hot day. But old standbys like cantaloupe and honeydew are now joined by more exotic varieties in the markets, and their subtleties are worth exploring - in soups, salads and other creative dishes.",http://www.npr.org/2011/07/27/138698041/the-many-melons-of-summer
29,7/20/2011,The Lighter Side Of Traditional Soviet Summer Fare,"The former Soviet Union once spanned an area nearly the size of North America, and the flavors of that empire remain rooted in regional cuisines. But it's not all stick-to-your-ribs fare like borscht and potatoes and dumplings. There's also a strong tradition of light meals that make the most of summer.",http://www.npr.org/2011/07/20/138513444/the-lighter-side-of-traditional-soviet-summer-fare
28,7/13/2011,The Glorious Pasta Of Summer,"Beat the heat (and the spaghetti-and-meatball doldrums) by pairing fun pasta shapes with fast, fresh sauces - hardly sauces at all, actually, but simple sautes of vegetables and herbs in olive oil.",http://www.npr.org/2011/07/14/137794595/the-glorious-pasta-of-summer
27,7/6/2011,"Fresh, Feisty Arugula: More Than A Salad Green","Known as ""rocket"" in parts of the world, arugula has an explosive, peppery flavor that pairs perfectly with sweet or citrusy fruits and salty meats and cheeses. Here, arugula takes meaty pizza, nutty quinoa and creamy pasta dishes to new heights.",http://www.npr.org/2011/07/06/137623588/fresh-feisty-arugula-more-than-a-salad-green
26,7/4/2011,July 4 Barbecue From America's Melting Pot,"All over the world, people have been grilling since they discovered fire, and immigrants to the United States brought their signature flavors with them. Hot dogs and burgers are joined by chorizo, kalbi, yakitori, kebab and more as we fire up the grill for Independence Day.",http://www.npr.org/2011/07/06/137472461/july-4-barbecue-from-americas-melting-pot
25,6/21/2011,'No Wheat' Doesn't Mean 'No Noodles',"Out of fellow-feeling for friends who eat gluten-free, food writer and noodle lover T. Susan Chang pondered a life without wheat that is not a life without noodles. When it comes to wheat-free, she says, Asian rice noodles are the crossover stars. But they're not alone.",http://www.npr.org/2011/07/06/137219913/no-wheat-doesn-t-mean-no-noodles
24,6/15/2011,Party Like The Swedes On Summer Solstice,The Swedish summer solstice celebration of ,http://www.npr.org/2011/07/06/137176955/party-like-the-swedes-on-summer-solstice
23,6/8/2011,"Oh, The Things You Can Do With A Farm-Share Box","Sign up with a local farm for periodic samplings of vegetables and fruits, and sometimes eggs and dairy and more. You might not always recognize every item in the box of goodies you'll get, but they're almost certain to inspire. These recipes will help get you started.",http://www.npr.org/2011/07/06/137034621/oh-the-things-you-can-do-with-a-farm-share-box
22,6/1/2011,Nuts For Nutella,"There are many other brands of chocolate-hazelnut spreads, and it can even be made at home. But for food writer Monica Bhide, there is only one Nutella. This sweet, cheerful reminder of her childhood inspires recipes and serving suggestions from fellow fans near and far.",http://www.npr.org/2011/07/06/136824166/nuts-for-nutella
21,5/25/2011,Homemade Sausages For A Memorable Day,The traditional start of grilling season - Memorial Day weekend - offers an opportunity to impress cookout crowds with freshly made links or patties.,http://www.npr.org/2011/07/06/136616733/homemade-sausages-for-a-memorable-day
20,5/18/2011,Canned Won't Do: Spring Brings Fresh Bamboo Shoots,"Bearing no relation to the stringy, bland canned version, fresh bamboo shoots invoke a spirit of gratitude in these savory recipes with Japanese roots. The young tips of the hardwood stalks - tender and aromatic, with a taste like artichoke, corn and hearts of palm - are a fleeting springtime crop.",http://www.npr.org/2011/07/06/136394119/canned-wont-do-spring-brings-fresh-bamboo-shoots
19,5/11/2011,Sweet And Spicy Flavors Of Northern Thailand,"In Chiang Mai, food writer Eve Turow discovered a key to regional cooking: simplicity. Her favorite recipes showcase Thai mastery of the four basic tastes (sweet, salty,  bitter and sour) while letting fresh ingredients shine. At home, she re-creates the dishes she fell in love with.",http://www.npr.org/2011/05/11/136175803/sweet-and-spicy-flavors-of-northern-thailand
18,5/4/2011,"Say It With Flour: Muffins, Scones And Waffles For Mother's Day","Baked goods are just the ticket for kids (and adults) who want to whip up a treat for dear Mom. The batter or  dough can be made before it goes anywhere near the heat, there are no  knives or open flames to worry about, and  the cooking time allows ample opportunity to clean up and break  out the crayons to make a card.",http://www.npr.org/2011/05/04/135634688/say-it-with-flour-muffins-scones-waffles-for-mom
17,4/27/2011,Garam Masala: A Taste Worth Acquiring,"Every region in India, every area, every house, every cook within every house has a favorite version of this warm blend of spices, says food writer Monica Bhide. Its potency didn't appeal to her when she was a child, but she grew to appreciate the magic behind ",http://www.npr.org/2011/04/27/135761263/garam-masala-a-taste-worth-acquiring
16,4/20/2011,Miso: An Ancient Solution For Modern Meals,"The fermented soybean paste long used in Asian cooking is now commonly found in U.S. food stores. With its bold flavors and colors, a dollop of miso can help transform simple ingredients into an unusual, delectable and elegant meal in a matter of minutes.",http://www.npr.org/2011/04/20/135543251/miso-an-ancient-solution-for-modern-meals
15,4/13/2011,A Passover Recipe As Easy As Matzo Pie,"Minas, or layered matzo pies, are found in Jewish cuisine from Egypt to Turkey to the Isle of Rhodes. Sheets of stiff matzo crackers are softened with water until pliable, then layered with savory fillings and baked, yielding something akin to a Passover-friendly, Ottoman-inflected take on lasagna.",http://www.npr.org/2011/04/13/135345886/a-passover-recipe-as-easy-as-matzo-pie
14,4/6/2011,Getting To The Heart Of The Artichoke,"It may look intimidating, but beneath the thorny exterior, the artichoke is richly flavored, nutritious and totally worth the trouble.",http://www.npr.org/2011/04/06/135163626/getting-to-the-heart-of-the-artichoke
13,3/30/2011,The Other Half Of The Egg,"If you find yourself tearing through egg yolks in the kitchen, with a surplus of whites left behind, don't just toss them out. It's the white that gives life to sweet and spicy nuts, sichuan pork and classic cookies like macaroons and financiers.",http://www.npr.org/2011/03/30/134953739/the-other-half-of-the-egg
12,3/23/2011,Cooking With Yogurt: Cultured Flavors,"This protein-rich ingredient has an important place at the Indian table. It's used to tenderize meat, as a souring agent and as a base for curries, as well as in desserts. Making your own yogurt is simple, and cooking with it isn't too complicated, if you know a few tricks.",http://www.npr.org/2011/03/23/134759766/cooking-with-yogurt-cultured-flavors
11,3/16/2011,Eating O' The Greens: Beyond Southern Side Dishes,"Although they're known as a slow-cooked, down-home side dish, greens aren't just for Southerners. Their flavors - from sweet to bitter to earthy - brighten soups, salads, omelets and more.",http://www.npr.org/2011/03/21/134564185/you-dont-have-to-be-southern-to-love-greens
10,3/8/2011,Making Math Appetizing: Pies For Pi Day,"When you think of food-focused holidays in March, St. Patrick's Day may leap to mind. But before you start counting clover leaves, there's some other math to do. Pi Day, celebrated on March 14, pays homage to the mathematics of a circle with, of course, pie.",http://www.npr.org/2011/03/14/134367508/celebrating-the-pies-of-march
9,3/2/2011,Welcome Fruit To Savory Dishes,Trying to figure out what do with that chicken breast or pork chop? Take a look in your fruit bowl. The sweet flavors of fresh and dried fruits liven up a meaty main dish or even a veggie side.,http://www.npr.org/2011/03/03/134167591/welcome-fruit-to-savory-dishes
8,2/23/2011,There's More To Okra Than Frying,"If you've had a slimy dining experience with this slender green vegetable, have no fear: Food writer Monica Bhide shares her grandmother's slime-busting tips, plus recipes that go beyond the traditional Southern fried fare.",http://www.npr.org/2011/02/23/133965525/theres-more-to-okra-than-frying
7,2/16/2011,Totally Tubers: Rugged Winter Veggies Take Root,"Beneath their homely exteriors, celery root, Jerusalem artichokes, jicama and other tubers and roots have a lot to offer - adding flavor,  color and texture to the winter pot. And now these gnarly undergrounders are starting to step into the limelight.",http://www.npr.org/2011/02/17/133779706/totally-tuber-rugged-root-veggies-make-a-splash
6,2/9/2011,Chocolate Savories For Your Sweet,"A glittery, heart-shaped box of chocolates certainly is charming, but  that isn't all there is. Take a page from the ancients' cookbook and  give your loved one a series of savory chocolate pleasures. Vegetables, chicken, beef and pork all get a boost from this Valentine's Day staple.",http://www.npr.org/2011/02/09/133594508/chocolate-savories-for-your-sweet
5,2/2/2011,"Chinese New Year, Trinidad-Style","It may not be the first thing that comes to mind when you think of the Caribbean island, but Chinese food is as much a part of Trinidad as sandy beaches, palm trees and rum cocktails. And the New Year celebrations are a perfect showcase for the fusion fare.",http://www.npr.org/2011/02/02/133406659/chinese-new-year-trinidad-style
4,1/26/2011,Groovy Recipes That Are So Granola,"The crunchy-sweet concoction that became synonymous with the '60s is having a resurgence, with a boost from spices like cardamom. And it goes beyond the cereal bowl to bars, cookies and scones.",http://www.npr.org/2011/01/26/133213620/groovy-recipes-that-are-so-granola
3,1/19/2011,Chowders Are Winners On Winter Table,"Hovering somewhere between a soup and a stew, all chowders start with a good stock, salt and starch. And in the end, a true chowder has chunks. But if you're not trying to win your local sailing club's annual chowder competition, there's plenty of room to improvise.",http://www.npr.org/2011/01/19/133024115/chowders-are-winners-on-winter-table
2,1/12/2011,Not All Biscotti Are Created Equal,"Sometimes a cup of coffee is simply not enough. Sometimes a cup of  coffee needs a biscotti. But not just any biscotti. This baton-shaped Italian cookie should be dense, chunky, dunkable -- and noisy till the end.",http://www.npr.org/2011/01/12/132837211/not-all-biscotti-are-created-equal
1,1/4/2011,The Art Of The Danish Open-Face Sandwich,"In a country where understatement and simplicity reign, the unpretentious smorrebrod is a national dish. There are countless variations, from minimal to lavish, but all reflect straightforward Scandinavian sensibilities: simple, honest, local ingredients attractively presented with little waste.",http://www.npr.org/2011/01/04/132627711/the-art-of-the-danish-open-face-sandwich
52,12/29/2010,Sparkling Ways To Celebrate The Holidays,"If plain champagne just doesn't cut it, here's a host of other bubbly drinks to toast with, from the classic French 75 to a Douglas Fir Sparkletini. The basic cocktail building blocks of sparkle, spirit, sour and sweet can be combined in seemingly endless variations.",http://www.npr.org/2010/12/30/132399963/sparkling-ways-to-celebrate-the-holidays
51,12/17/2010,Homemade Candy Answers The Holiday Gift Question,"It's the perfect gift, as Fannie Farmer's classic cookbook states: ""Homemade candy, made from real cream, butter, fresh nuts, and rich chocolate, is a real and wonderful surprise."" And it's easier than you might think to whip up caramels, toffee, brittle, fudge and other treats.",http://www.npr.org/2010/12/18/132132539/homemade-candy-answers-the-holiday-gift-question
50,12/14/2010,Cider: A Winter Kitchen's Secret Weapon,"Apple cider - the alcoholic variety - was part of the foundation of America. Now its sweet descendant turns up often in school lunchboxes and at blood drives. But cider isn't just good for sipping; the apple slurry lends earthy sweetness to savory dishes in a brine, a vinaigrette and a glaze.",http://www.npr.org/2011/03/21/132054630/cider-winter-kitchen-s-secret-weapon
49,12/8/2010,Christmas Cookies Win A Trip To The Caribbean,Food writer Ramin Ganeshram marries the flavors of her West Indian heritage with the homey methods of American traditions in what has become her holiday ritual.,http://www.npr.org/2010/12/30/131872548/christmas-cookies-win-a-trip-to-the-caribbean
48,12/1/2010,Practical Locavorism: Bananas In Winter,"Food writer Peggy Bourjaily joined the movement to eat more seasonal foods from local sources, but the limited menu during the off-season didn't necessarily fly with her family. Then she found a way to invite other fruits and vegetables into her life -- but only during the cold months.",http://www.npr.org/2010/11/30/131695451/practical-locavorism-bananas-in-winter
47,11/24/2010,Thanksgiving Dinner With A Lighter Touch,"The holidays are a time of tradition, especially at the dining table. But America is a nation of blended tastes, so there's also room to experiment, right? Try this veggie-centric fare - simple in ingredients yet rich in flavor and substance - and you'll never miss the gravy.",http://www.npr.org/2010/11/23/131541045/thanksgiving-dinner-with-a-lighter-touch
46,11/17/2010,"You Say Hazelnuts, I Say Filberts: Any Way, Delicious","Depending on where you live, you may know these bronze-shelled little nuts by a number of names. And their uses are just as varied. From the nation's hazelnut capital, Oregon, come recipes for nut-studded salad, pasta and more.",http://www.npr.org/2010/11/16/131357714/you-say-filberts-i-say-hazelnuts-any-way-delicious
45,11/10/2010,Why I Don't Cook For My Parents,The meals we prepare and eat with our families growing up become synonymous with home. Food writer Monica Bhide says she loves to get recipe advice from her dad. But she rarely cooks her creations for him when they're together -- because she misses his cooking so much.,http://www.npr.org/templates/story/story.php?storyId=131183505
44,11/3/2010,Moving The Cheese From Starter Plate To Dessert Tray,"Sure, artisan cheeses can stand alone. But add those complex flavors -- salty, sweet, savory, earthy and lush all at once -- to a typical truffle or cookie, and the result is a delicious marriage.",http://www.npr.org/templates/story/story.php?storyId=130996934
43,10/27/2010,Winter Squash: New Faces In The Pumpkin Patch,"If you've had enough of the seemingly ubiquitous butternut squash soup, have no fear. Butternut and acorn squash are making way for varieties like kabocha and jarrahdale. Yes, squash is the latest ""it"" fruit, so it's time to go beyond butternut.",http://www.npr.org/templates/story/story.php?storyId=130833903
42,10/20/2010,Oven Fries: Having It Both Ways,"It can be hard to resist the crispy, salty temptation to ""Have It Your Way,"" but you can ditch the fast-food fries and make your own -- in the oven. It takes a bit more time, but you won't mind when you taste your piping-hot potatoes, chicken and other favorites.",http://www.npr.org/templates/story/story.php?storyId=130673515
41,10/13/2010,Tips For Picnics On The Tailgate,"Whether you're a sports fan or just someone who enjoys eating al fresco, think advance prep, bite-size, knife-free -- and go team!",http://www.npr.org/templates/story/story.php?storyId=130514655
40,10/6/2010,Not A Fan Of Beer? These Pairings May Win You Over,"You may think you don't like beer, but with Oktoberfest celebrations in full swing, you might want to reconsider. Start with a ""transitional"" beer and flavorful foods to match, and you'll be saying ""cheers"" in no time.",http://www.npr.org/templates/story/story.php?storyId=130354379
39,9/29/2010,"Have Your (Less Sinful) Cupcake And Enjoy It, Too","Of course, a cupcake is meant to be decadent. But it's possible to pack some nutrition into these trendy little treats and still feel like you're indulging -- without the guilt that can come with consuming the full-calorie versions.",http://www.npr.org/templates/story/story.php?storyId=130191177
38,9/21/2010,"Home-Style Hangzhou Cuisine: Subtle, Not Spicy","It's maybe not as well-known as Sichuan or Cantonese fare, but Zhejiang province (Hangzhou is its capital) still boasts one of China's eight distinct culinary traditions. True to the region's emphasis on fresh ingredients and mellow flavors, these light dishes also are easy to try at home.",http://www.npr.org/templates/story/story.php?storyId=130021572
37,9/15/2010,Bringing The Bean Out Of Its Shell,"Scrap the canned beans and bag the dried ones -- it's time for fresh beans, still nestled in their protective shells. With the help of a few chatty friends or relatives, in no time you'll have plenty of beans freed from their casings and ready for all kinds of hearty, vibrant dishes.",http://www.npr.org/templates/story/story.php?storyId=129855166
36,9/8/2010,Why The Priest Fainted: An Ode To Eggplant,"This fruit commonly used as vegetable is perhaps less loved in the U.S. than in India and the Mideast, where food writer Monica Bhide grew up. But after years of presenting different renditions to American friends and family, she's found ways to woo the eggplant skeptics - including these spice-laden recipes and tips.",http://www.npr.org/2010/09/08/129707905/why-the-priest-fainted-an-ode-to-eggplant
35,9/1/2010,Learning Who You Are Through What You Eat,"The long Labor Day weekend marks the end of summer for many in the U.S., but it's also a time when ethnic churches hold massive food festivals to celebrate their origins. For food writer Michele Kayal and her young daughter, Syrian festivals -- and the preparations for them -- are an enduring link to the past.",http://www.npr.org/templates/story/story.php?storyId=129554547
34,8/25/2010,DIY Wedding Cake: Secret Ingredient Is Love,It isn't quick -- or easy -- but making a cake for someone's wedding is a wonderful gift and a money-saver for the newlyweds. Food writer Nicole Spiridakis relays tips and recipes from her cake-crafting success story.,http://www.npr.org/templates/story/story.php?storyId=129403566
33,8/18/2010,Hawaii's Ono Kine Grinds (Good Food),"From a hamburger patty and gravy on rice (""loco moco"") to poor man's sushi (""poke""), everyday cuisine in the ethnically diverse Aloha state reflects the intermingling of cultures that created it.",http://www.npr.org/templates/story/story.php?storyId=129254697
32,8/11/2010,Verrines: A Glass Act,"These luscious little dishes comprise alternating layers of complementary colors, textures and flavors -- all showcased in clear glass containers. A verrine is most commonly a dessert, but appetizers, salads, side dishes and even whole meals can be adapted to this stripey presentation.",http://www.npr.org/templates/story/story.php?storyId=129104081
31,8/3/2010,Cracking The Lychee 'Nut',"Don't let the prickly skin deter you. Beneath that tough exterior is a bold, luscious fruit with tons of potential, from savory main courses to dessert.",http://www.npr.org/templates/story/story.php?storyId=128951468
30,7/28/2010,"Have Your Limoncello And Eat It, Too","Although traditionally served as an after-dinner sipper, this Italian liqueur is perfectly suited for any time of day -- particularly in a cocktail. But don't just drink it. Make your own, then use it for cooking and baking to impart creamy, lemony flavor without a lot of acidity.",http://www.npr.org/templates/story/story.php?storyId=128800809
29,7/21/2010,Shredded Salads: Meals For The Lazy Cook,"Summertime inspires dizzying feats of laziness in the kitchen. Liquid lunches, random fruit meet-ups, meals consisting of things you can throw in a blender -- anything to avoid summer's Public Enemy No. 1: the stove. These easy-to-make, easy-to-eat salads won't impose on your downtime.",http://www.npr.org/templates/story/story.php?storyId=128643604
28,7/14/2010,Getting Kids Into The Kitchen,Tired of the same old ice pops? Try these cool treats from chefs and food writers to keep youngsters entertained this summer.,http://www.npr.org/templates/story/story.php?storyId=128490458
27,7/7/2010,Lessons From A Corny Childhood,"Tending her family's garden as a youngster seemed like one big summertime chore to Janet Zimmerman. But one thing made all the toil worth it, she says: corn so fresh it was growing in the afternoon, and on her plate by dinnertime. She's since discovered that on the cob isn't the only way to enjoy it.",http://www.npr.org/templates/story/story.php?storyId=128339700
26,6/30/2010,Give Chickpeas A Chance,"In the Middle East, the origins of traditional dishes like hummus are the subject of contentious debate across cultures and borders. But Israeli food writer Vered Guttman suggests that these culinary similarities are reason for hope.",http://www.npr.org/templates/story/story.php?storyId=128195004
25,6/23/2010,Weed It And Reap: A Meal With Nature's Outcasts,"Instead of obliterating the plant pests in your garden, try harvesting them. After all, they've been fattened up on your good compost and diligent watering all season. All you need is an open mind - and the appetite to go with it.",http://www.npr.org/2010/06/23/128010832/weed-it-and-reap-a-meal-with-natures-outcasts
24,6/16/2010,Making Butter Chicken With Dad,"Food writer Monica Bhide's father is an engineer by trade. But when he wasn't out of town for work, he was at home in the kitchen, making his child's favorite butter chicken. Though she now makes the dish herself for her own family, she's happy to still need Dad's help to get it just right.",http://www.npr.org/templates/story/story.php?storyId=127853185
23,6/7/2010,You Don't Have To Be Italian To Eat Broccoli Rabe,Food writer Susan Russo's mom often served the vegetable to family -- never to visitors who might not be acquainted with it. But times have changed. Broccoli rabe's appeal has grown -- and Russo recommends sharing it with family ,http://www.npr.org/templates/story/story.php?storyId=127561145
22,6/2/2010,Beyond Shirley Temples: The New Maraschino Cherry,"Fishing the sticky-sweet, hot-pink orb from the bottom of a soda glass was a rite of childhood. But set aside that store-bought variety and make your own, with fresh cherries -- and a few fresh ideas for showcasing them.",http://www.npr.org/templates/story/story.php?storyId=127349094
21,5/25/2010,Cilantro: The Controversial Herb,"Like politics and religion, this leafy plant elicits strong opinions. Even its name is subject to debate: The leaves are called cilantro, while the seeds are called coriander -- at least in the U.S. But it's so easy-growing and versatile that it is featured in cuisines from all over the world -- which means ample opportunity to join the debate.",http://www.npr.org/templates/story/story.php?storyId=127092887
20,5/18/2010,Market-Fresh Breakfasts,"You don't have to wait till lunch or dinner to dig into your early-bird haul from the farmers market. Tuck some fresh vegetables into your morning meal -- or, better yet, give them a starring role at the table.",http://www.npr.org/templates/story/story.php?storyId=126911529
19,5/12/2010,Feeding The Hungry Traveler,"Wandering from airport vendor to airport vendor in search of a meal that's even remotely nutritious can be exhausting -- and, in some airports, completely fruitless. Avoid the food-court shuffle by packing up these sturdy, delicious dishes before you leave home.",http://www.npr.org/templates/story/story.php?storyId=126741304
