week,pub_date,title,teaser,url
47,11/19/2008,A Vegetarian Thanksgiving,"Even if you don't live meatlessly yourself, you might have a vegetarian or vegan at your Thanksgiving table. Offer your meat-free guests something more substantial than a cobbled-together plate of traditional vegetable side dishes.",http://www.npr.org/2008/11/19/97137098/a-vegetarian-thanksgiving
46,11/12/2008,Beefer Madness,"In ""Eat Local country,"" food writer T. Susan Chang says, neighbors get together to buy ""beefers"" - whole steers - from a nearby farm. Her share - some fresh ground beef, steaks, tongue and even a heart - provided for a year of memorable eating.",http://www.npr.org/templates/story/story.php?storyId=96865367
45,11/5/2008,Coaxing The Black Walnut Out Of Its Shell,"Black walnuts are tough to process and have an earthy flavor that doesn't appeal to everyone. But fans of America's native nut can showcase its natural richness in distinctive dishes, from baked sweets to savory sauces.",http://www.npr.org/2008/11/05/96258175/coaxing-the-black-walnut-out-of-its-shell
44,10/29/2008,Grown-Up Tricks For Treats,"If you love Halloween candy but outgrew trick-or-treating - and creepy-crawly eyeball cupcakes - years ago, desserts featuring Halloween favorites like toffee bars and peanut butter cups will make you feel like a kid again.",http://www.npr.org/templates/story/story.php?storyId=96179573
43,10/22/2008,The Many Faces Of The Great Pumpkin,"Pumpkin is an autumn staple suited for far more than its traditional Halloween and Thanksgiving roles. In soup, stew or cake, or just roasted in long slices, pumpkin is appropriate for any chilly evening, whatever you happen to be celebrating.",http://www.npr.org/templates/story/story.php?storyId=95898412
42,10/15/2008,Fall Soups For Body And Soul,"As the cost of fuel rises and the mercury drops, when the world seems full of dry leaves and cold shoulders, hold out your bowl for fall's abundance. It's almost impossible to feel impoverished or hopeless when you have a warm bellyful of soup.",http://www.npr.org/templates/story/story.php?storyId=95605411
41,10/8/2008,It's The Time Of Year To Go Plum Crazy,"Purple-black, sweet-tart Italian prune plums are far easier to cook with than their summer cousins, making them a favorite for desserts as well as savory dishes. But better act fast - the season is short, and it's already upon us.",http://www.npr.org/templates/story/story.php?storyId=95437400
40,10/1/2008,An Autumnal Feast,"Fall brings the kind of days when you're glad to be inside, standing over a hot stove and listening to the rain on the roof. Celebrate with a hearty meal featuring a farmers-market bounty - and capped with a pear-studded rustic bread pudding.",http://www.npr.org/templates/story/story.php?storyId=95216942
39,9/24/2008,Taking The Risk Out Of Risotto,"Risotto has a reputation as a risky endeavor requiring constant, slow stirring - and no shortcuts. But a little practice and the proper technique can open the door to countless variations of this creamy, Italian rice dish.",http://www.npr.org/templates/story/story.php?storyId=94939511
38,9/17/2008,The Wine-With-Vegetables Challenge,"It may be challenging to find wines to pair with vegetables, but it's not impossible. It's especially worth the effort at this time of year. Plates laden with the harvest's abundance will only be enhanced by the right glass of wine.",http://www.npr.org/templates/story/story.php?storyId=94630846
37,9/10/2008,Perfection Is A Fresh Fig,"Tender, ripe figs require no manipulation or fuss. But once you've had your fill of them in their sweet, natural state, try them with meats or salad greens, or in baked desserts. The fresh, fleshy fruits add honeyed flavor and lush texture to any dish.",http://www.npr.org/templates/story/story.php?storyId=94391625
36,9/3/2008,Finding Answers To The School Lunch Test,"It can be tough to find that happy middle ground between whole-grain pasta with veggies that won't get eaten, and marshmallow creme on white bread that will. But Betsy Block, mother of two school-age kids, has a plan for packed lunches.",http://www.npr.org/2008/09/03/94196698/finding-answers-to-the-school-lunch-test
35,8/27/2008,Dinner's Secret Weapon: The Make-Ahead Marinade,"If you long to be one of those people with a freezer full of easy weeknight meals, master the art of pre-made marinades and then fire up the grill. But don't be surprised if your family starts clamoring daily for the magic of grilled meat.",http://www.npr.org/templates/story/story.php?storyId=93597800
34,8/20/2008,Paella Perfect: Rediscover True Flavors Of Spain,Paella prepared on a kettle grill and served with a glass of cool sangria made for a magical party for food writer Bonny Wolf. But first she gathered a few tips on the proper equipment and ingredients for this traditional Spanish meal.,http://www.npr.org/templates/story/story.php?storyId=93698135
33,8/13/2008,You Can't Judge A Corn By Its Color,"Corn may vary in color by region, but it's all equally sweet - especially during peak season. The summertime staple shines on its own - seasoned and grilled to perfection - or in side dishes from homey to fancy.",http://www.npr.org/templates/story/story.php?storyId=93499757
32,8/6/2008,Summer Soups: A Cool Quartet,"Like the sound of ice clattering in the cocktail shaker, or the first whiff of charcoal smoke from the grill, the first sip of cool soup is a one-way ticket away from the labors of the day. Whip up these refreshing soups with just a few ingredients, an hour of preparation and a few hours' chill time.",http://www.npr.org/templates/story/story.php?storyId=93135535
31,7/30/2008,The Art Of Sandwich-Making,"At its simplest, a sandwich is bread enclosing a filling. It also can be a perfectly balanced meal, with protein, vegetable, carbohydrate, dairy and even fruit - and can reflect the culture of a city or an entire nation. And it can be eaten - as its creator intended - by hand.",http://www.npr.org/templates/story/story.php?storyId=93025402
30,7/23/2008,Summer Squash Gets Some Respect,"Zucchini and its kin are the sleeper hits among garden blockbusters such as tomatoes and berries. They may not be greeted with raves when you grill the first harvest of yellow crooknecks, but summer squash have the versatility and easy-going nature to sustain a long, successful run in your kitchen.",http://www.npr.org/templates/story/story.php?storyId=92739541
29,7/16/2008,Forget The Granola: Camp Cooking Goes Gourmet,"Camp cooking doesn't have to mean dehydrated, over-salted soups and powdered potatoes. With a little experimentation and forethought, most cooks can turn out fantastic meals from scratch - even outside of a kitchen.",http://www.npr.org/templates/story/story.php?storyId=92419216
28,7/9/2008,Watermelon Confidential: Dessert And So Much More,"Most people eat watermelon plain, and often for dessert, but it has great potential to enliven savory dishes. The key is to pick a perfect melon,  then balance its sweetness with salty, bitter, acidic or spicy flavors. The harvest peaks in July and August.",http://www.npr.org/templates/story/story.php?storyId=92325350
27,7/2/2008,Deep In The Heart Of Texas Barbecue,It's the Fourth of July and time for a barbecue - but don't just throw some hamburgers and hot dogs on the grill. Take a stab at making real Texas barbecue - and all the fixings.,http://www.npr.org/templates/story/story.php?storyId=92030958
26,6/25/2008,Breakfast Baking: Better Fast Food,"Breakfast has long been touted as the most important meal of the day. It gives you energy and keeps your appetite in check until dinner. But who has time to eat it? One solution to the modern breakfast dilemma isn't faster fast food, but a mainstay of home baking - the quick bread.",http://www.npr.org/templates/story/story.php?storyId=91812924
25,6/18/2008,Savoring the Melon Season,"Of all the melons that appear in markets each summer, the sweet, orange-fleshed cantaloupe - or netted muskmelon - is the most popular. The fruit's light, fresh flavor shines in sweet or savory dishes.",http://www.npr.org/templates/story/story.php?storyId=91555071
24,6/11/2008,Dad's Madeleines: A Remembrance of Things Past,"As a child devouring homemade madeleines, Elizabeth Tannen didn't realize there was anything unusual about her father's twist on the classic French treat or that it had a literary connotation. Years later, with a madeleine pan from her dad, she developed a few twists of her own.",http://www.npr.org/templates/story/story.php?storyId=91315387
23,6/4/2008,The Making of a Feta Fan,"Though she waves the flag of her Greek heritage proudly, Nicole Spiridakis says, she never liked feta - until she went to Greece last summer and really ",http://www.npr.org/templates/story/story.php?storyId=91066850
22,5/28/2008,Strawberry Fields Forever,"Although strawberries are available year round, there is nothing quite like the flavor of fresh, locally grown berries in the spring. They are a delight to both the eyes and the taste buds and can be enjoyed in recipes both sweet and savory.",http://www.npr.org/templates/story/story.php?storyId=90786910
21,5/21/2008,Cooking for a Crowd,"Catering a large event yourself isn't impossible. But it does require careful, even obsessive, planning. Writer and personal chef Kevin Weeks shares his tips and some foolproof recipes for your next big gathering.",http://www.npr.org/templates/story/story.php?storyId=90647585
20,5/14/2008,"Cherchez La Chervil, the Forgotten Herb","Though it may look like parsley, chervil is in a class all by itself. The spring herb with anise aromas is an obvious choice to accent other seasonal favorites such as salmon or trout, asparagus, new potatoes, baby carrots and salads of baby greens.",http://www.npr.org/templates/story/story.php?storyId=90383059
19,5/7/2008,Three-Dish Cure for the Dim Sum Blues,"The Chinese smorgasbord of small-plate dishes known as dim sum is one of life's unreproducible pleasures, writes T. Susan Chang. What if you live far from the bustle of Chinatown? Never fear, she shares three simple recipes to sate your craving.",http://www.npr.org/templates/story/story.php?storyId=90231154
18,4/30/2008,Simple Gifts: The Shaker Way to Cook and Eat,"The Shakers - a religious group that splintered from an English Quaker community in the 18th century - did sustainable way before sustainable was cool. They left behind recipes for simple, wholesome food prepared with exactness and imagination.",http://www.npr.org/templates/story/story.php?storyId=89943917
17,4/23/2008,Taking the Mystery out of the Artichoke,"Food blogger Susan Russo's mother taught her how to eat a stuffed artichoke when she was 6. Once she tasted the soft, buttery artichoke flesh and moist, chewy bread filling, she was smitten. She demystifies the spiky vegetable with the tasty heart.",http://www.npr.org/templates/story/story.php?storyId=89816658
16,4/16/2008,A Seder with a Syrian Flavor,"Move over gefilte fish and matzo-meal cakes. In the exotic, fragrant and flavorful cuisine of the Ashkenazic Jews of Aleppo, Bonny Wolf has found enticing options for her traditional Seder menu this Passover. She shares some of her favorites.",http://www.npr.org/templates/story/story.php?storyId=89659889
15,4/9/2008,Cauliflower: A Love Story,"A bunch of cauliflower florets - tossed lightly in olive oil and salt, and thrown into an oven - marked the start of a love affair for Nicole Spiridakis. She writes about why a life without the funny-looking crucifer is no life at all.",http://www.npr.org/templates/story/story.php?storyId=89482490
14,4/2/2008,Crepes Success: Dreams of a French Sojourn,"As a penniless student in Paris, Alejandra Garcia discovered the allure of crepes - and she has never looked back. The thin pancakes are a foolproof entree or dessert. All you need to add is a little imagination.",http://www.npr.org/templates/story/story.php?storyId=89272328
13,3/26/2008,"Roast Fish: An Elegant, Flavorful and Easy Solution","It almost seems perverse to take a fish, that wateriest of creatures, from its ocean home and subject it to the pummeling heat blast of a 450-degree oven. But it's a magical punishment, like that which turns coal into diamonds.",http://www.npr.org/templates/story/story.php?storyId=89044024
12,3/19/2008,Nan's Way: The Only Way to Make Easter Pies,"For Italians, Easter means both religious and culinary celebration. And for Susan Russo, it means pies, both savory and sweet, made from recipes by her grandmother Nan: ricotta pie, rice pie and ",http://www.npr.org/templates/story/story.php?storyId=88470828
11,3/12/2008,Food and Longing in Southeast Asia,"On a trip to Southeast Asia, Julie O'Hara made eating her top priority. To her, eating the food of a place is a priceless opportunity and real authenticity in travel often boils down to a bowl of incredible noodles from a street vendor.",http://www.npr.org/templates/story/story.php?storyId=88107761
10,3/5/2008,Kernels of Truth About Cornmeal,"Many years ago, a recipe for Indian pudding introduced 9-year-old Kevin Weeks to the wonders of cornmeal. Mush - the collective term for dishes such as polenta, Indian pudding and grits - is a splendid way to enjoy ground corn.",http://www.npr.org/templates/story/story.php?storyId=87812611
9,2/27/2008,The Shad Are Running,"The forsythia is blooming, and that, fishermen say, means just one thing: The shad are in the river - and at the market. Bonny Wolf loves the fish, but she's just wild about the roe. She shares her favorite ways to prepare the seasonal delicacy.",http://www.npr.org/templates/story/story.php?storyId=48730288
8,2/20/2008,When Pizza Gets All Dressed Up,"Why mess with the simplicity and inexpensiveness of Domino's? Because getting creative with unconventional ingredients means infinite ways to enjoy one of the world's most appealing foods. After all, it's just pizza. It's easy as pie.",http://www.npr.org/templates/story/story.php?storyId=19170027
7,2/13/2008,Kumquats: Discovering the Sweetness of Sour,"The exotic fruit's diminutive size and impossibly cheerful orange color first caught food blogger Susan Russo's eye. But it was an explosive, tart taste that kept her coming back for more. She shares her favorite kumquat recipes.",http://www.npr.org/templates/story/story.php?storyId=18828304
6,2/6/2008,Vegan Valentine: Healthier Sweets for Everyone,"Forget heavy, fruit-and-nut-filled offerings from the local co-op. Just in time for that sweetest time of year, Nicole Spiridakis offers hip vegan twists on tried-and-true dessert classics that match up to their traditional counterparts.",http://www.npr.org/templates/story/story.php?storyId=18713211
5,1/30/2008,Slow Cookers Yield Rich Flavors in No Time,There's something truly satisfying about coming home on a winter's day and breathing in the savory scent of pork braised in wine - especially when it's ready to eat when you walk in the door. April Fulton rediscovers the beauty of the slow cooker.,http://www.npr.org/templates/story/story.php?storyId=18430583
4,1/23/2008,Say It With Chocolate Bread,"Chocolate bread, neither bread nor chocolate, is in a class all its own. Make it when you have something to say, because the only response to a statement phrased in chocolate bread is to roll over and say ""yes.""",http://www.npr.org/2011/03/21/18183909/say-it-with-chocolate-bread
3,1/16/2008,Red Hots Spice Up Everyday Cooking,"Originally used to decorate cookies and cakes, Red Hots now can be found on ingredient lists for a variety of dishes. The sweet and spicy candies can add some serious pizazz to virtually any food that benefits from a dash of cinnamon.",http://www.npr.org/2008/01/16/18096284/red-hots-spice-up-everyday-cooking
2,1/9/2008,Revitalizing the Dried Bean,"For many, ""dried beans"" conjures up memories of school cafeterias and grayish-brown, lumpy dishes devoid of flavor and with the texture of library paste. An Egyptian cook's inventive use of dried legumes gave Kevin Weeks a newfound respect for them.",http://www.npr.org/templates/story/story.php?storyId=17793851
51,12/19/2007,How to Cook Your Goose,"The first goose that food writer Bonny Wolf made was a disaster, a tough bird swimming in fat. Since then, she has grown to relish the bird's rich, flavorful meat - and its fat - and wants others to learn from her mistakes.",http://www.npr.org/templates/story/story.php?storyId=17336306
50,12/12/2007,Savoring Memories of Sunday Dinner,"As a girl, Susan Russo remembers how every Italian-American woman with any pride started cooking ""gravy"" - tomato sauce with meat - by breakfast on Sundays so it would be ready for a 2 p.m. meal. Russo shares memories of the Sunday dinners of her childhood.",http://www.npr.org/templates/story/story.php?storyId=17112087
49,12/5/2007,Chocolate Helps the Bourbon Go Down,"After moving to Kentucky 20 years ago, D. Cameron Lawrence discovered you can't travel far in the state without running into bourbon. There was only one problem: She couldn't stand the stuff - until she met her first chocolate-bourbon ball.",http://www.npr.org/templates/story/story.php?storyId=16818225
48,11/28/2007,Eggnog: A Potent Family Tradition,"Almost every Thanksgiving for 50 years, Kevin Weeks' father has made eggnog and aged it until Christmas - making it almost impossible to detect the alcohol. Weeks shares his family's recipe.",http://www.npr.org/templates/story/story.php?storyId=16631663
47,11/21/2007,Consider the Chesapeake Bay Oyster,"Sometimes called Chesapeake white gold, the Chesapeake oyster has a flavor and texture that begs connoisseurs to come back and shuck just a few more. Kendra Bailey Morris explores the debate over how best to enjoy them and shares a few options.",http://www.npr.org/templates/story/story.php?storyId=16369187
46,11/14/2007,Giving Thanks for a Bounty of All-American Wines,"What goes with turkey and gravy, cranberry sauce, yams and mashed potatoes, Brussels sprouts and pumpkin pie? For Thanksgiving, that most American holiday, Cyrus Musiker advises trying wines from across the United States.",http://www.npr.org/templates/story/story.php?storyId=16274205
45,11/6/2007,Beyond Potstickers: A Dumpling Lover's Confession,"No matter how it's prepared, breaking into a dumpling's not-yet-unveiled center summons the excitement of a pile of brightly wrapped birthday presents.  Deb Perelman shares her love and a few recipes for the dumpling's many varieties.",http://www.npr.org/templates/story/story.php?storyId=16059555
44,10/31/2007,"Quinoa: A Sacred, Super Crop","Considered a sacred crop by the Incas, quinoa has been classified as a ""super crop"" by the United Nations because of its high protein content. Quinoa plants produce nutty, earthy-tasting kernels that are great in pilafs, soups and porridges.",http://www.npr.org/templates/story/story.php?storyId=15749697
43,10/24/2007,Soul Cakes: Hallowed Offerings for Hungry Ghosts,"Forget the Reese's Pieces and Tootsie Rolls: This year, appease the malevolent spirits roaming the earth on All Souls' Eve with soul cakes. T. Susan Chang shares the story of and a recipe for the sweet and steaming treats.",http://www.npr.org/templates/story/story.php?storyId=15536354
42,10/17/2007,Medjool: A Date to Remember,"Considered the diamond of dates, Medjools are prized for their large size, extraordinary sweetness and chewy texture. For blogger Susan Russo, there are few foods as delectable as fresh Medjools. She shares her favorite ways of enjoying them.",http://www.npr.org/templates/story/story.php?storyId=15282847
41,10/10/2007,Eid ul-Fitr: Ramadan's Sweet Ending,This is a sweet time of year for Muslims. Literally. ,http://www.npr.org/2007/10/10/15135985/eid-ul-fitr-ramadans-sweet-ending
40,10/3/2007,Canned Salmon: Take a Walk on the Wild Side,"A clean, safe and sustainable seafood option, canned wild salmon is also high in omega-3s. Betsy Block explains why it's preferable to other kinds of salmon and tuna, and shares a few ways to get the healthy fish into your family's diet.",http://www.npr.org/templates/story/story.php?storyId=14932302
39,9/26/2007,Making Over the Much-Maligned Eggplant,"Whether because of its Mr. Potato Head looks or its befuddling nature, eggplant gets a bad rap. When it's bad, it's very, very bad: soggy, bitter and rubbery. But given the right vehicle, eggplant can show off its versatility and velvety texture.",http://www.npr.org/templates/story/story.php?storyId=14707086
38,9/19/2007,New Mexico: Chile Hot Spot,"In New Mexico - the largest producer of chiles in the United States - the spicy peppers are more than just a crop: They're a culture, a way of life. And this time of year, the aroma of roasting chiles permeates the air throughout the state.",http://www.npr.org/templates/story/story.php?storyId=14529268
37,9/12/2007,In Love with the Fish Taco and Its Hometown,"The fish taco is to San Diego what the Philly cheese steak is to Philadelphia or the lobster roll is to Maine. Susan Russo, a transplant to the city, extols the virtues of the food with a humble appearance yet bliss-inducing capabilities.",http://www.npr.org/templates/story/story.php?storyId=14333245
36,9/5/2007,Reviving Lemon-Lime Icebox Cake,"After inheriting her grandmother's recipe box, April Fulton reveled in making one of her favorite childhood desserts: lemon-lime icebox cake. But she wanted to capture the cake's essence without resorting to commercial mixes.",http://www.npr.org/templates/story/story.php?storyId=14169378
35,8/29/2007,Building a Better Burger,"From its humble beginnings as Hamburg steak or ""salt beef"" favored by European immigrants to the United States, the burger has morphed into an all-American dish with countless varieties. Kevin Weeks shares some of his favorites.",http://www.npr.org/templates/story/story.php?storyId=13971617
34,8/22/2007,The Curious Incident of the Funnel Cake in the Lawn,"As a 6-year-old, T. Susan Chang experienced her first culinary fiasco: a funnel cake gone horribly wrong. Thirty years passed before she dared once again to make the decadent spirals of deep-fried batter sprinkled with powdered sugar.",http://www.npr.org/templates/story/story.php?storyId=13745947
33,8/15/2007,"Preserving Our Past, One Jar at a Time","For Kendra Bailey Morris, canning represents the bounty of the season, and is as much a family tradition as holiday turkey. Like her grandmothers and mother before her, Morris now looks forward to the annual ritual of storing the fruits and vegetables of summer.",http://www.npr.org/templates/story/story.php?storyId=12780637
32,8/8/2007,Coleslaw: You Could Be a Star,"Relegated to a side dish, coleslaw is frequently forgotten until the very last moment of picnic prep, picked up last minute, and then promptly ignored. No more. Deb Perelman offers tips for turning your coleslaw from bland to glam.",http://www.npr.org/templates/story/story.php?storyId=12570289
31,8/1/2007,Hunt for Wild Blackberries Leads to Friendship,"Mollie Cox Bryan wanted to write a biography of the 88-year-old owner of Mrs. Rowe's Restaurant in Staunton, Va. But Mildred Rowe deflected Bryan's efforts to get to know her - until the subject of blackberries came up.",http://www.npr.org/templates/story/story.php?storyId=12389859
30,7/25/2007,"Something Old, New, Pickled and Blue","Before her fianc? came along, food blogger Molly Wizenberg didn't think about pickles much. The jarred dills she grew up with were nice, but nothing to make a fuss about. Then along came Brandon -- and a universe of things pickled and brined.",http://www.npr.org/templates/story/story.php?storyId=12111218
29,7/18/2007,Granita by Any Name Would Taste as Sweet,"Pick a liquid - coffee, champagne, even carrot juice - add sugar and other desired flavorings, and stick in the freezer. Stir every now and again, and you have granita, a refreshing dessert perfect for summer.",http://www.npr.org/templates/story/story.php?storyId=12030425
28,7/11/2007,Falling in Love with Limas,"It's the season for fresh lima beans - despised by generations of schoolchildren but beloved by writer D. Cameron Lawrence. She explains why she loves the the nutritional powerhouses, and shares her favorite recipes.",http://www.npr.org/templates/story/story.php?storyId=11861532
27,7/4/2007,Spam: More than Junk Mail or Junk Meat,"Created by Hormel Foods in 1937 and promoted as ""the miracle meat,"" Spam became K-ration fare for American GIs and Allied forces during World War II. The  ""war-time delicacy"" is still a favorite in Howard Yoon's cupboard. He explains why.",http://www.npr.org/templates/story/story.php?storyId=11714236
26,6/27/2007,A Four-Corners Fourth,"A truly American feast should showcase celebratory foods from each corner of the United States, says April Fulton. She shares a Fourth of July menu that spans the tastes of New England, the South, the Southwest and the Northwest.",http://www.npr.org/templates/story/story.php?storyId=11441502
25,6/20/2007,Cherries on Top,"The cherry season is all too short, so make the most of it while you still can. While it's tempting to use cherries for desserts such as a trifle or clafoutis, they are equally suited to breakfast, appetizers and as accents in dinner dishes.",http://www.npr.org/templates/story/story.php?storyId=11192195
24,6/13/2007,What's a Wedding Without Cookies?,"The cookie table is as likely to be at the top of some brides' wedding checklist as dresses, centerpieces and color schemes. For Mollie Cox Bryan, the must-have wedding tradition is something more: a touchstone of her past, lovingly made by women whom she had known her whole life.",http://www.npr.org/templates/story/story.php?storyId=10965922
